{
  "artifacts": [
    {
      "digest": "sha256:d04df9e14636660c4bc54e36315719b0382bacc7cd6f96120960db88ec7ca03a",
      "kind": "sidecar",
      "path": "executables.v4.json"
    },
    {
      "digest": "sha256:70ca9c2696d710018be89a1f8fa406e1185698ec623fbd7860e0bb70fdcd0897",
      "kind": "executable",
      "path": "runtime/adapter.py"
    }
  ],
  "contracts": [
    {
      "contract_id": "tobkiri.service.media.analysis.v1",
      "operations": [
        "rumi_media_analysis_adapter_pack.media-analysis"
      ],
      "revision_digest": "sha256:db0d8f22944459d426e2aca1ec98180000b2f2b4cc435097ede4c09b4d32ed93"
    }
  ],
  "functions": [
    {
      "contract_revision_digest": "sha256:db0d8f22944459d426e2aca1ec98180000b2f2b4cc435097ede4c09b4d32ed93",
      "id": "rumi_media_analysis_adapter_pack.media-analysis.adapter",
      "implementation_digest": "sha256:70ca9c2696d710018be89a1f8fa406e1185698ec623fbd7860e0bb70fdcd0897",
      "isolation": "dedicated_process",
      "operations": [
        "rumi_media_analysis_adapter_pack.media-analysis"
      ],
      "role": "brokered"
    }
  ],
  "integrity": {
    "artifact_set_digest": "sha256:8745410a540d71f4afc8a189e7daf802673d3a3efa1fb67ca2d7a532e3751616",
    "contract_catalog_digest": "sha256:019e2f329df5625f1e1cece358df7821d6253304ba9868ae99dd997863e36370",
    "source_identity": "sha256:2383a868e187b31697d5d6e3cc282dd8a76669d7351b53f2fadafaa99f227317"
  },
  "migration": {
    "compatibility": "read_only",
    "legacy_ids": [
      "rumi.service.media.analysis.v1",
      "rumi:ecosystem/rumi_media_analysis_adapter_pack",
      "rumi_media_analysis_adapter_pack"
    ],
    "removal_wave": 10,
    "sunset_at": "2027-12-31"
  },
  "operation_catalog": [
    {
      "contract_reference": "tobkiri.service.media.analysis.v1",
      "effect_ceiling": [
        "capability:media.analysis"
      ],
      "operation_id": "rumi_media_analysis_adapter_pack.media-analysis",
      "owner": "rumi_media_analysis_adapter_pack",
      "provider_id": "rumi_media_analysis_adapter_pack.media-analysis.adapter",
      "source_kind": "canonical_v4_contract"
    }
  ],
  "pack": {
    "artifact_digest": "sha256:8745410a540d71f4afc8a189e7daf802673d3a3efa1fb67ca2d7a532e3751616",
    "display_name": "Rumi Media Analysis Adapter",
    "id": "rumi_media_analysis_adapter_pack",
    "kind": "normal_sandbox",
    "version": "1.0.0"
  },
  "pack_api_version": "io.tobkiri.pack.v4",
  "provenance": {
    "evidence": [
      {
        "digest": "sha256:2383a868e187b31697d5d6e3cc282dd8a76669d7351b53f2fadafaa99f227317",
        "path": "schemas/pack_v4_catalog.v1.json",
        "rule_id": "canonical-pack-v4-source-record"
      }
    ],
    "generator": "tobkiri.scripts.migrate_pack_artifacts_v4",
    "generator_version": "1.0.0",
    "normative": true,
    "repository_commit": "1329f300cd2a8e15170edb1accce8d7c3167882b",
    "repository_tree": "8820370fd87572920444d7c9dc642735b35194e6e1610ad99d242a5958fb876c",
    "schema": "io.tobkiri.provenance.v1",
    "source_digest": "sha256:2383a868e187b31697d5d6e3cc282dd8a76669d7351b53f2fadafaa99f227317",
    "source_kind": "migration",
    "source_path": "schemas/pack_v4_catalog.v1.json#/packs/rumi_media_analysis_adapter_pack"
  },
  "provider_catalog": [
    {
      "contract_reference": "tobkiri.service.media.analysis.v1",
      "operations": [
        "rumi_media_analysis_adapter_pack.media-analysis"
      ],
      "owner": "rumi_media_analysis_adapter_pack",
      "provider_id": "rumi_media_analysis_adapter_pack.media-analysis.adapter"
    }
  ],
  "requirements": {
    "approval_policy": "none",
    "capabilities": [
      "ai.audio.transcribe",
      "ai.image",
      "media.analysis",
      "media.inspect"
    ],
    "contract_dependencies": [
      {
        "cardinality": "one",
        "contract_id": "tobkiri.service.ai.audio.transcribe.v1",
        "optional": false,
        "version_range": ">=1.0.0 <2.0.0"
      },
      {
        "cardinality": "one",
        "contract_id": "tobkiri.service.ai.image.v1",
        "optional": false,
        "version_range": ">=1.0.0 <2.0.0"
      },
      {
        "cardinality": "one",
        "contract_id": "tobkiri.service.media.inspect.v1",
        "optional": false,
        "version_range": ">=1.0.0 <2.0.0"
      }
    ],
    "execution_boundary": "sandbox",
    "network": {
      "allowed_domains": [],
      "allowed_ports": []
    },
    "pack_dependencies": {
      "rumi_ai_modality_pack": ">=1.0.0,<2.0.0",
      "rumi_media_inspect_service_pack": ">=1.0.0,<2.0.0"
    },
    "secrets": [],
    "workspace_boundary": "pack_local"
  }
}
