{
  "artifacts": [
    {
      "digest": "sha256:79dfa590caf9b015781b7d64a637190e192d15ace5f279d40d9ffb0295f5f9ad",
      "kind": "sidecar",
      "path": "executables.v4.json"
    }
  ],
  "contracts": [],
  "functions": [],
  "integrity": {
    "artifact_set_digest": "sha256:37b99b504839c83b03b65e810b03591103bf7afca111978287b5d9bc24e25dd1",
    "contract_catalog_digest": "sha256:067ad0defdf647048a83732b37a47a3be6d2b1950c16e5c493b7e75b7e3fe2c9",
    "source_identity": "sha256:791d3223e9412b8087ba149a2277f1a963bc80619f44bf834efe55226159f53f"
  },
  "migration": {
    "compatibility": "read_only",
    "legacy_ids": [
      "rumi:ecosystem/rumi_sop_mining_pack",
      "rumi_sop_mining_pack"
    ],
    "removal_wave": 10,
    "sunset_at": "2027-12-31"
  },
  "operation_catalog": [],
  "pack": {
    "artifact_digest": "sha256:37b99b504839c83b03b65e810b03591103bf7afca111978287b5d9bc24e25dd1",
    "display_name": "Rumi SOP Mining Pack",
    "id": "rumi_sop_mining_pack",
    "kind": "application",
    "version": "0.1.0"
  },
  "pack_api_version": "io.tobkiri.pack.v4",
  "provenance": {
    "evidence": [
      {
        "digest": "sha256:791d3223e9412b8087ba149a2277f1a963bc80619f44bf834efe55226159f53f",
        "path": "schemas/pack_v4_catalog.v1.json",
        "rule_id": "canonical-pack-v4-source-record"
      }
    ],
    "generator": "tobkiri.scripts.migrate_pack_artifacts_v4",
    "generator_version": "1.0.0",
    "normative": true,
    "repository_commit": "1329f300cd2a8e15170edb1accce8d7c3167882b",
    "repository_tree": "8820370fd87572920444d7c9dc642735b35194e6e1610ad99d242a5958fb876c",
    "schema": "io.tobkiri.provenance.v1",
    "source_digest": "sha256:791d3223e9412b8087ba149a2277f1a963bc80619f44bf834efe55226159f53f",
    "source_kind": "migration",
    "source_path": "schemas/pack_v4_catalog.v1.json#/packs/rumi_sop_mining_pack"
  },
  "provider_catalog": [],
  "requirements": {
    "approval_policy": "none",
    "capabilities": [],
    "contract_dependencies": [],
    "execution_boundary": "declarative_only",
    "network": {
      "allowed_domains": [],
      "allowed_ports": []
    },
    "pack_dependencies": {},
    "secrets": [],
    "workspace_boundary": "pack_local"
  }
}
