{
  "artifacts": [
    {
      "digest": "sha256:1441297c649051ee4776ff72c63f5f918ab015b1936f0035902f549a46370892",
      "kind": "sidecar",
      "path": "executables.v4.json"
    },
    {
      "digest": "sha256:a36fb70dcb0688c414dd734e1398b64a8799f74d2ddbb707595ebb47a42dae87",
      "kind": "executable",
      "path": "runtime/adapter.py"
    }
  ],
  "contracts": [
    {
      "contract_id": "tobkiri.service.connector.adapter.v1",
      "operations": [
        "rumi_mobile_pairing_connector_pack.mobile-pairing-adapter"
      ],
      "revision_digest": "sha256:afde263510cb01641f3135fe0e3cb2f0e5be239ca1ae3ff84778357f5fb61e18"
    }
  ],
  "functions": [
    {
      "contract_revision_digest": "sha256:afde263510cb01641f3135fe0e3cb2f0e5be239ca1ae3ff84778357f5fb61e18",
      "id": "rumi_mobile_pairing_connector_pack.connector.mobile_pairing",
      "implementation_digest": "sha256:a36fb70dcb0688c414dd734e1398b64a8799f74d2ddbb707595ebb47a42dae87",
      "isolation": "dedicated_process",
      "operations": [
        "rumi_mobile_pairing_connector_pack.mobile-pairing-adapter"
      ],
      "role": "brokered"
    }
  ],
  "integrity": {
    "artifact_set_digest": "sha256:42efe0de1057152c7e4c6368cadff853e878f185eaa3d493cc13cabd86331ec5",
    "contract_catalog_digest": "sha256:2d2127e0dc3e12834e4625a3a80d77ef55dc07bdc940d325bab50e6bd5f7c0a2",
    "source_identity": "sha256:da724561c797e0e7d7f0ca5c251cfda7eaa5b0c5d4ce7e7d0ce694433ae2973c"
  },
  "migration": {
    "compatibility": "read_only",
    "legacy_ids": [
      "rumi.service.connector.adapter.v1",
      "rumi:ecosystem/rumi_mobile_pairing_connector_pack",
      "rumi_mobile_pairing_connector_pack"
    ],
    "removal_wave": 10,
    "sunset_at": "2027-12-31"
  },
  "operation_catalog": [
    {
      "contract_reference": "tobkiri.service.connector.adapter.v1",
      "effect_ceiling": [
        "capability:connector.adapter.verify",
        "capability:connector.delivery.execute"
      ],
      "operation_id": "rumi_mobile_pairing_connector_pack.mobile-pairing-adapter",
      "owner": "rumi_mobile_pairing_connector_pack",
      "provider_id": "rumi_mobile_pairing_connector_pack.connector.mobile_pairing",
      "source_kind": "canonical_v4_contract"
    }
  ],
  "pack": {
    "artifact_digest": "sha256:42efe0de1057152c7e4c6368cadff853e878f185eaa3d493cc13cabd86331ec5",
    "display_name": "Rumi Mobile Pairing Connector",
    "id": "rumi_mobile_pairing_connector_pack",
    "kind": "normal_sandbox",
    "version": "1.0.0"
  },
  "pack_api_version": "io.tobkiri.pack.v4",
  "provenance": {
    "evidence": [
      {
        "digest": "sha256:da724561c797e0e7d7f0ca5c251cfda7eaa5b0c5d4ce7e7d0ce694433ae2973c",
        "path": "schemas/pack_v4_catalog.v1.json",
        "rule_id": "canonical-pack-v4-source-record"
      }
    ],
    "generator": "tobkiri.scripts.migrate_pack_artifacts_v4",
    "generator_version": "1.0.0",
    "normative": true,
    "repository_commit": "1329f300cd2a8e15170edb1accce8d7c3167882b",
    "repository_tree": "8820370fd87572920444d7c9dc642735b35194e6e1610ad99d242a5958fb876c",
    "schema": "io.tobkiri.provenance.v1",
    "source_digest": "sha256:da724561c797e0e7d7f0ca5c251cfda7eaa5b0c5d4ce7e7d0ce694433ae2973c",
    "source_kind": "migration",
    "source_path": "schemas/pack_v4_catalog.v1.json#/packs/rumi_mobile_pairing_connector_pack"
  },
  "provider_catalog": [
    {
      "contract_reference": "tobkiri.service.connector.adapter.v1",
      "operations": [
        "rumi_mobile_pairing_connector_pack.mobile-pairing-adapter"
      ],
      "owner": "rumi_mobile_pairing_connector_pack",
      "provider_id": "rumi_mobile_pairing_connector_pack.connector.mobile_pairing"
    }
  ],
  "requirements": {
    "approval_policy": "capability_gated",
    "capabilities": [
      "connector.adapter.verify",
      "connector.delivery.execute",
      "credential.resolve",
      "host.authority.consume",
      "mobile.relay"
    ],
    "contract_dependencies": [
      {
        "cardinality": "one",
        "contract_id": "tobkiri.service.credential.resolve.v1",
        "optional": false,
        "version_range": ">=1.0.0 <2.0.0"
      },
      {
        "cardinality": "one",
        "contract_id": "tobkiri.service.host.authorize.v1",
        "optional": false,
        "version_range": ">=1.0.0 <2.0.0"
      },
      {
        "cardinality": "optional",
        "contract_id": "tobkiri.transport.mobile.relay.v1",
        "optional": true,
        "version_range": ">=1.0.0 <2.0.0"
      }
    ],
    "execution_boundary": "sandbox",
    "network": {
      "allowed_domains": [],
      "allowed_ports": []
    },
    "pack_dependencies": {
      "rumi_credential_broker_pack": ">=1.0.0,<2.0.0",
      "rumi_host_authority_bridge_pack": ">=1.0.0,<2.0.0"
    },
    "secrets": [],
    "workspace_boundary": "pack_local"
  }
}
