{
  "artifacts": [
    {
      "digest": "sha256:369f34070197b81205f46aa0142f5c1a81276728171f1119867d37a46699cf4e",
      "kind": "sidecar",
      "path": "executables.v4.json"
    }
  ],
  "contracts": [],
  "functions": [],
  "integrity": {
    "artifact_set_digest": "sha256:4f889333dd2f5d1e58710b44a6749c45efaa82b928335aae689dfb8b294d9697",
    "contract_catalog_digest": "sha256:f6b66277b4948cb408fc9f8887d5c40e099be70ed264e66195d59a0a52a7c496",
    "source_identity": "sha256:c6272eca785014a9a756db91da8d379bc4e3b6e84980d9d57ac0d91d459e9bbd"
  },
  "migration": {
    "compatibility": "read_only",
    "legacy_ids": [
      "rumi:ecosystem/rumi_multimodal_media_pack",
      "rumi_multimodal_media_pack"
    ],
    "removal_wave": 10,
    "sunset_at": "2027-12-31"
  },
  "operation_catalog": [],
  "pack": {
    "artifact_digest": "sha256:4f889333dd2f5d1e58710b44a6749c45efaa82b928335aae689dfb8b294d9697",
    "display_name": "Rumi Multimodal Media Pack",
    "id": "rumi_multimodal_media_pack",
    "kind": "application",
    "version": "0.1.0"
  },
  "pack_api_version": "io.tobkiri.pack.v4",
  "provenance": {
    "evidence": [
      {
        "digest": "sha256:c6272eca785014a9a756db91da8d379bc4e3b6e84980d9d57ac0d91d459e9bbd",
        "path": "schemas/pack_v4_catalog.v1.json",
        "rule_id": "canonical-pack-v4-source-record"
      }
    ],
    "generator": "tobkiri.scripts.migrate_pack_artifacts_v4",
    "generator_version": "1.0.0",
    "normative": true,
    "repository_commit": "1329f300cd2a8e15170edb1accce8d7c3167882b",
    "repository_tree": "8820370fd87572920444d7c9dc642735b35194e6e1610ad99d242a5958fb876c",
    "schema": "io.tobkiri.provenance.v1",
    "source_digest": "sha256:c6272eca785014a9a756db91da8d379bc4e3b6e84980d9d57ac0d91d459e9bbd",
    "source_kind": "migration",
    "source_path": "schemas/pack_v4_catalog.v1.json#/packs/rumi_multimodal_media_pack"
  },
  "provider_catalog": [],
  "requirements": {
    "approval_policy": "none",
    "capabilities": [],
    "contract_dependencies": [],
    "execution_boundary": "declarative_only",
    "network": {
      "allowed_domains": [],
      "allowed_ports": []
    },
    "pack_dependencies": {},
    "secrets": [],
    "workspace_boundary": "pack_local"
  }
}
