{
  "artifacts": [
    {
      "digest": "sha256:529778b403934625b7962bb814947681c03c1b381db7c653fd67dd992fd7f00e",
      "kind": "sidecar",
      "path": "executables.v4.json"
    },
    {
      "digest": "sha256:57fdce0cee3b5660cc37ccc3df9ad1fc633b96f14c9743371342adfaf987a6e2",
      "kind": "executable",
      "path": "runtime/adapter.py"
    }
  ],
  "contracts": [
    {
      "contract_id": "tobkiri.action.connector.route.v1",
      "operations": [
        "rumi_connector_company_adapter_pack.connector-company-route"
      ],
      "revision_digest": "sha256:ba5b6299d1bcf1847d0a5f2a3ff10dc1c19182414afd0555df74295f4306a9ec"
    }
  ],
  "functions": [
    {
      "contract_revision_digest": "sha256:ba5b6299d1bcf1847d0a5f2a3ff10dc1c19182414afd0555df74295f4306a9ec",
      "id": "rumi_connector_company_adapter_pack.connector-route.company",
      "implementation_digest": "sha256:57fdce0cee3b5660cc37ccc3df9ad1fc633b96f14c9743371342adfaf987a6e2",
      "isolation": "dedicated_process",
      "operations": [
        "rumi_connector_company_adapter_pack.connector-company-route"
      ],
      "role": "brokered"
    }
  ],
  "integrity": {
    "artifact_set_digest": "sha256:720597e0b1bd1617b3c71d7d6b3f3bfa67daf17d40ac3c9d4fa09f680bde2195",
    "contract_catalog_digest": "sha256:805364f5aeb902f4d45a366ec240cef07f46bec504e0d049cf956a58ab6fb455",
    "source_identity": "sha256:5037828d32c4c19f465bf433b7fdfc9ee2d3dafa27d2bc42d07126d0bc35b0d6"
  },
  "migration": {
    "compatibility": "read_only",
    "legacy_ids": [
      "rumi.action.connector.route.v1",
      "rumi:ecosystem/rumi_connector_company_adapter_pack",
      "rumi_connector_company_adapter_pack"
    ],
    "removal_wave": 10,
    "sunset_at": "2027-12-31"
  },
  "operation_catalog": [
    {
      "contract_reference": "tobkiri.action.connector.route.v1",
      "effect_ceiling": [
        "capability:connector.route"
      ],
      "operation_id": "rumi_connector_company_adapter_pack.connector-company-route",
      "owner": "rumi_connector_company_adapter_pack",
      "provider_id": "rumi_connector_company_adapter_pack.connector-route.company",
      "source_kind": "canonical_v4_contract"
    }
  ],
  "pack": {
    "artifact_digest": "sha256:720597e0b1bd1617b3c71d7d6b3f3bfa67daf17d40ac3c9d4fa09f680bde2195",
    "display_name": "Rumi Connector Company Adapter",
    "id": "rumi_connector_company_adapter_pack",
    "kind": "normal_sandbox",
    "version": "1.0.0"
  },
  "pack_api_version": "io.tobkiri.pack.v4",
  "provenance": {
    "evidence": [
      {
        "digest": "sha256:5037828d32c4c19f465bf433b7fdfc9ee2d3dafa27d2bc42d07126d0bc35b0d6",
        "path": "schemas/pack_v4_catalog.v1.json",
        "rule_id": "canonical-pack-v4-source-record"
      }
    ],
    "generator": "tobkiri.scripts.migrate_pack_artifacts_v4",
    "generator_version": "1.0.0",
    "normative": true,
    "repository_commit": "1329f300cd2a8e15170edb1accce8d7c3167882b",
    "repository_tree": "8820370fd87572920444d7c9dc642735b35194e6e1610ad99d242a5958fb876c",
    "schema": "io.tobkiri.provenance.v1",
    "source_digest": "sha256:5037828d32c4c19f465bf433b7fdfc9ee2d3dafa27d2bc42d07126d0bc35b0d6",
    "source_kind": "migration",
    "source_path": "schemas/pack_v4_catalog.v1.json#/packs/rumi_connector_company_adapter_pack"
  },
  "provider_catalog": [
    {
      "contract_reference": "tobkiri.action.connector.route.v1",
      "operations": [
        "rumi_connector_company_adapter_pack.connector-company-route"
      ],
      "owner": "rumi_connector_company_adapter_pack",
      "provider_id": "rumi_connector_company_adapter_pack.connector-route.company"
    }
  ],
  "requirements": {
    "approval_policy": "none",
    "capabilities": [
      "company.coordinate",
      "company.state.manage",
      "company.state.read",
      "connector.route",
      "host.authority.consume"
    ],
    "contract_dependencies": [
      {
        "cardinality": "one",
        "contract_id": "tobkiri.action.company.coordinator.v1",
        "optional": false,
        "version_range": ">=1.0.0 <2.0.0"
      },
      {
        "cardinality": "one",
        "contract_id": "tobkiri.action.company.state.v1",
        "optional": false,
        "version_range": ">=1.0.0 <2.0.0"
      },
      {
        "cardinality": "one",
        "contract_id": "tobkiri.resource.company.v1",
        "optional": false,
        "version_range": ">=1.0.0 <2.0.0"
      },
      {
        "cardinality": "one",
        "contract_id": "tobkiri.service.host.authorize.v1",
        "optional": false,
        "version_range": ">=1.0.0 <2.0.0"
      }
    ],
    "execution_boundary": "sandbox",
    "network": {
      "allowed_domains": [],
      "allowed_ports": []
    },
    "pack_dependencies": {
      "rumi_company_coordinator_pack": ">=1.0.0,<2.0.0",
      "rumi_company_state_store_pack": ">=1.0.0,<2.0.0",
      "rumi_host_authority_bridge_pack": ">=1.0.0,<2.0.0"
    },
    "secrets": [],
    "workspace_boundary": "pack_local"
  }
}
