{
  "artifacts": [
    {
      "digest": "sha256:d2e1e4a8adbaf335bf6a5d8781853a426617b06c695a540190958e9540b0df7e",
      "kind": "asset",
      "path": "catalog/artifact_schema.media.yaml"
    },
    {
      "digest": "sha256:ecb1c8ab803634c10bf5238908a1dab18bac4fa218c52df013f2c14370e24368",
      "kind": "sidecar",
      "path": "executables.v4.json"
    }
  ],
  "contracts": [],
  "functions": [],
  "integrity": {
    "source_identity": "sha256:e0536e8d0389227c4337230fb41f55e5e11f93d5c59fff50ca2f136c19e683b7",
    "artifact_set_digest": "sha256:68700228bca6ffdd095d19c7495532cc0a95107745a42dcd110124f8f80c3116",
    "contract_catalog_digest": "sha256:4f53cda18c2baa0c0354bb5f9a3ecbe5ed12ab4d8e11ba873c2f11161202b945"
  },
  "migration": {
    "compatibility": "read_only",
    "legacy_ids": [
      "rumi:ecosystem/rumi_multimodal_media_pack",
      "rumi_multimodal_media_pack"
    ],
    "removal_wave": 10,
    "sunset_at": "2027-12-31"
  },
  "operation_catalog": [],
  "pack": {
    "artifact_digest": "sha256:87eab2926665b389748f516abf5b38a105f11c0f14dd1e28ecd4214067b344e6",
    "display_name": "Rumi Multimodal Media Pack",
    "id": "rumi_multimodal_media_pack",
    "kind": "application",
    "version": "0.1.0"
  },
  "pack_api_version": "io.tobkiri.pack.v4",
  "provenance": {
    "schema": "io.tobkiri.provenance.v2",
    "source_kind": "generated",
    "source_path": "ecosystem/rumi_multimodal_media_pack/pack.v4.json",
    "source_digest": "sha256:e0536e8d0389227c4337230fb41f55e5e11f93d5c59fff50ca2f136c19e683b7",
    "repository_commit": "1329f300cd2a8e15170edb1accce8d7c3167882b",
    "repository_commit_trusted": false,
    "content_root_digest": "sha256:5907142e5cf7f8dd8783ceda1e62f5162e3e13336375fc26ea313b711687daef",
    "generator": "tobkiri.scripts.generate_defaultspack_v4_bundle",
    "generator_version": "2.1.0",
    "generator_path": "tobkiri_runtime/scripts/generate_defaultspack_v4_bundle.py",
    "generator_digest": "sha256:72e5fe4e8f670a1618d79b16dfc9896b6e9f4276616d87632022b726ec01735a",
    "input_inventory_digest": "sha256:f3d872a91f83cf424e8e252b5c63e1f8da0194eff321ac057ee3bae6be03a5f1",
    "normative": true,
    "evidence": [
      {
        "path": "tobkiri_runtime/scripts/generate_defaultspack_v4_bundle.py",
        "rule_id": "normative-generator-bytes",
        "digest": "sha256:72e5fe4e8f670a1618d79b16dfc9896b6e9f4276616d87632022b726ec01735a"
      },
      {
        "path": "ecosystem/rumi_multimodal_media_pack/pack.v4.json",
        "rule_id": "normative-input-bytes",
        "digest": "sha256:e0536e8d0389227c4337230fb41f55e5e11f93d5c59fff50ca2f136c19e683b7"
      }
    ]
  },
  "provider_catalog": [],
  "requirements": {
    "approval_policy": "none",
    "capabilities": [],
    "contract_dependencies": [],
    "execution_boundary": "declarative_only",
    "network": {
      "allowed_domains": [],
      "allowed_ports": []
    },
    "pack_dependencies": {},
    "secrets": [],
    "workspace_boundary": "pack_local"
  }
}
