{
  "artifacts": [
    {
      "digest": "sha256:771167cb6303fa1af77c9dbf2d9a82eb95e7a8e1492878eebc2c8c0bdca6d0ab",
      "kind": "sidecar",
      "path": "executables.v4.json"
    },
    {
      "digest": "sha256:cd2d06b9bd6bb08025a13edd92c696bb4b2c1033463298bcafb5b151543f34b8",
      "kind": "executable",
      "path": "runtime/coordinator.py"
    }
  ],
  "contracts": [
    {
      "contract_id": "tobkiri.action.team.coordinate.v1",
      "operations": [
        "rumi_team_coordinator_pack.team-coordinate-control"
      ],
      "revision_digest": "sha256:6fae4f5a5dd18b2e09f7329a5b0af1becf1c7b4fb9c1d0740b547d564f889306"
    },
    {
      "contract_id": "tobkiri.action.job.adapter.v1",
      "operations": [
        "rumi_team_coordinator_pack.team-supervisor-job-adapter"
      ],
      "revision_digest": "sha256:086b92fb87a1a02d3e4ff1d679b3b23beb8885ecec2d47299588a7a5ee2e064d"
    },
    {
      "contract_id": "tobkiri.resource.team.runtime.v1",
      "operations": [
        "rumi_team_coordinator_pack.team-runtime-resource"
      ],
      "revision_digest": "sha256:2efd1c0f122aabc9ee2eff00116f831132d9fcb884b9f50d7e7224a1ac429a36"
    }
  ],
  "functions": [
    {
      "contract_revision_digest": "sha256:086b92fb87a1a02d3e4ff1d679b3b23beb8885ecec2d47299588a7a5ee2e064d",
      "id": "rumi_team_coordinator_pack.job-adapter.team-supervisor",
      "implementation_digest": "sha256:cd2d06b9bd6bb08025a13edd92c696bb4b2c1033463298bcafb5b151543f34b8",
      "isolation": "dedicated_process",
      "operations": [
        "rumi_team_coordinator_pack.team-supervisor-job-adapter"
      ],
      "role": "brokered"
    },
    {
      "contract_revision_digest": "sha256:6fae4f5a5dd18b2e09f7329a5b0af1becf1c7b4fb9c1d0740b547d564f889306",
      "id": "rumi_team_coordinator_pack.team.coordinate",
      "implementation_digest": "sha256:cd2d06b9bd6bb08025a13edd92c696bb4b2c1033463298bcafb5b151543f34b8",
      "isolation": "dedicated_process",
      "operations": [
        "rumi_team_coordinator_pack.team-coordinate-control"
      ],
      "role": "brokered"
    },
    {
      "contract_revision_digest": "sha256:2efd1c0f122aabc9ee2eff00116f831132d9fcb884b9f50d7e7224a1ac429a36",
      "id": "rumi_team_coordinator_pack.team.runtime",
      "implementation_digest": "sha256:cd2d06b9bd6bb08025a13edd92c696bb4b2c1033463298bcafb5b151543f34b8",
      "isolation": "dedicated_process",
      "operations": [
        "rumi_team_coordinator_pack.team-runtime-resource"
      ],
      "role": "brokered"
    }
  ],
  "integrity": {
    "source_identity": "sha256:81b6cfbc7ca1be44c860953809fe260c1389f69e1d3ef5e6a4c1f6a7a119c508",
    "artifact_set_digest": "sha256:874ab81fe9e0fd4e284b58aa1621842b8476d9cdf9b4b8d041dc6531aaba0f65",
    "contract_catalog_digest": "sha256:b211ddcf100a8957275163e9f44f194bf7454782f0e599b72da4685f9578f6fe"
  },
  "migration": {
    "compatibility": "read_only",
    "legacy_ids": [
      "rumi.action.company.coordinator.v1",
      "rumi.action.job.adapter.v1",
      "rumi.resource.company.runtime.v1",
      "rumi:ecosystem/rumi_company_coordinator_pack",
      "rumi_company_coordinator_pack",
      "tobkiri.action.company.coordinator.v1",
      "tobkiri.resource.company.runtime.v1"
    ],
    "removal_wave": 10,
    "sunset_at": "2027-12-31"
  },
  "operation_catalog": [
    {
      "operation_id": "rumi_team_coordinator_pack.team-coordinate-control",
      "owner": "rumi_team_coordinator_pack",
      "contract_reference": "tobkiri.action.team.coordinate.v1",
      "provider_id": "rumi_team_coordinator_pack.team.coordinate",
      "source_kind": "canonical_v4_contract",
      "effect_ceiling": []
    },
    {
      "operation_id": "rumi_team_coordinator_pack.team-runtime-resource",
      "owner": "rumi_team_coordinator_pack",
      "contract_reference": "tobkiri.resource.team.runtime.v1",
      "provider_id": "rumi_team_coordinator_pack.team.runtime",
      "source_kind": "canonical_v4_contract",
      "effect_ceiling": []
    },
    {
      "operation_id": "rumi_team_coordinator_pack.team-supervisor-job-adapter",
      "owner": "rumi_team_coordinator_pack",
      "contract_reference": "tobkiri.action.job.adapter.v1",
      "provider_id": "rumi_team_coordinator_pack.job-adapter.team-supervisor",
      "source_kind": "canonical_v4_contract",
      "effect_ceiling": []
    }
  ],
  "pack": {
    "artifact_digest": "sha256:f6ffae000481214f4280676719574a82f53e52450ef07cb3b3a0cd46fc1c3717",
    "display_name": "Rumi Team Coordinator Pack",
    "id": "rumi_team_coordinator_pack",
    "kind": "normal_sandbox",
    "version": "1.0.0"
  },
  "pack_api_version": "io.tobkiri.pack.v4",
  "provenance": {
    "schema": "io.tobkiri.provenance.v2",
    "source_kind": "generated",
    "source_path": "ecosystem/rumi_team_coordinator_pack/pack.v4.json",
    "source_digest": "sha256:81b6cfbc7ca1be44c860953809fe260c1389f69e1d3ef5e6a4c1f6a7a119c508",
    "repository_commit": "1329f300cd2a8e15170edb1accce8d7c3167882b",
    "repository_commit_trusted": false,
    "content_root_digest": "sha256:4a28c8f773b6bd8f3c553a3a179c37d29ddf55efa3ee440369faf1d5c4212e8e",
    "generator": "tobkiri.scripts.generate_defaultspack_v4_bundle",
    "generator_version": "2.1.0",
    "generator_path": "tobkiri_runtime/scripts/generate_defaultspack_v4_bundle.py",
    "generator_digest": "sha256:4303ad9df98db2fdc01cfd1fe30c4e03f4bfa279342e49f7ed656d6d49af7a85",
    "input_inventory_digest": "sha256:1aa6ec26305032fc069ab4e1a94aa0d7990d5fe5ed182e90c931213c78be6b2f",
    "normative": true,
    "evidence": [
      {
        "path": "tobkiri_runtime/scripts/generate_defaultspack_v4_bundle.py",
        "rule_id": "normative-generator-bytes",
        "digest": "sha256:4303ad9df98db2fdc01cfd1fe30c4e03f4bfa279342e49f7ed656d6d49af7a85"
      },
      {
        "path": "ecosystem/rumi_team_coordinator_pack/pack.v4.json",
        "rule_id": "normative-input-bytes",
        "digest": "sha256:81b6cfbc7ca1be44c860953809fe260c1389f69e1d3ef5e6a4c1f6a7a119c508"
      }
    ]
  },
  "provider_catalog": [
    {
      "provider_id": "rumi_team_coordinator_pack.job-adapter.team-supervisor",
      "owner": "rumi_team_coordinator_pack",
      "contract_reference": "tobkiri.action.job.adapter.v1",
      "operations": [
        "rumi_team_coordinator_pack.team-supervisor-job-adapter"
      ]
    },
    {
      "provider_id": "rumi_team_coordinator_pack.team.coordinate",
      "owner": "rumi_team_coordinator_pack",
      "contract_reference": "tobkiri.action.team.coordinate.v1",
      "operations": [
        "rumi_team_coordinator_pack.team-coordinate-control"
      ]
    },
    {
      "provider_id": "rumi_team_coordinator_pack.team.runtime",
      "owner": "rumi_team_coordinator_pack",
      "contract_reference": "tobkiri.resource.team.runtime.v1",
      "operations": [
        "rumi_team_coordinator_pack.team-runtime-resource"
      ]
    }
  ],
  "requirements": {
    "approval_policy": "capability_gated",
    "capabilities": [
      "team.coordinate",
      "team.runtime.observe",
      "team.state.manage",
      "team.state.read",
      "team.work",
      "host.authority.consume",
      "job.adapter.invoke"
    ],
    "contract_dependencies": [
      {
        "cardinality": "one",
        "contract_id": "tobkiri.action.team.state.v1",
        "optional": false,
        "version_range": ">=1.0.0 <2.0.0"
      },
      {
        "cardinality": "many",
        "contract_id": "tobkiri.action.team.work.v1",
        "optional": false,
        "version_range": ">=1.0.0 <2.0.0"
      },
      {
        "cardinality": "one",
        "contract_id": "tobkiri.resource.team.v1",
        "optional": false,
        "version_range": ">=1.0.0 <2.0.0"
      },
      {
        "cardinality": "one",
        "contract_id": "tobkiri.service.host.authorize.v1",
        "optional": false,
        "version_range": ">=1.0.0 <2.0.0"
      }
    ],
    "execution_boundary": "sandbox",
    "network": {
      "allowed_domains": [],
      "allowed_ports": []
    },
    "pack_dependencies": {
      "rumi_host_authority_bridge_pack": ">=1.0.0,<2.0.0",
      "rumi_team_state_store_pack": ">=1.0.0,<2.0.0"
    },
    "secrets": [],
    "workspace_boundary": "pack_local"
  }
}
